{
  "orgnr": "973063804",
  "navn": "ADECCO NORGE AS AVD OSLO",
  "forretningsadresse": {
    "gateadresse": {
      "gatenavn": "Rosenkrantz' gate 16"
    },
    "postnr": "0160",
    "poststed": "OSLO",
    "land": "NORGE"
  },
  "postadresse": {
    "gateadresse": {
      "gatenavn": "Postboks 2013 Vika"
    },
    "postnr": "0125",
    "poststed": "OSLO",
    "land": "NORGE"
  }
}
