{
  "orgnr": "982683955",
  "navn": "EXPERIS AS",
  "forretningsadresse": {
    "gateadresse": {
      "gatenavn": "Lakkegata 53"
    },
    "postnr": "0187",
    "poststed": "OSLO",
    "land": "NORGE"
  },
  "postadresse": {
    "gateadresse": {
      "gatenavn": "Postboks 2506 Solli"
    },
    "postnr": "0202",
    "poststed": "OSLO",
    "land": "NORGE"
  }
}
